{
 "id": "ceti-owala-soft",
 "name": "CETI Owala soft",
 "color": {
  "bg": "#F4E4D2",
  "ink": "#1A1612",
  "accent": "#7A2E4A",
  "accent2": "#4FB3A4",
  "muted": "#4A3A5C",
  "line": "#C8C9CB",
  "panel": "#E8D9C0",
  "chalk": "#1A1612"
 },
 "type": {
  "disp": {
   "family": "Fraunces",
   "weight": 300,
   "style": "italic"
  },
  "mono": {
   "family": "Space Mono",
   "weight": 400
  },
  "body": {
   "family": "DM Sans",
   "weight": 400
  }
 },
 "texture": "none",
 "tempo": {
  "ease": "expo",
  "beat_s": 4
 },
 "voice": {
  "register": "Owala soft: warm cream, one deep ink, berry as the live colour, a tide of teal for the other voice",
  "end_card": "CETI"
 }
}