{ "id": "ceti-boardwalk-light",
  "name": "CETI boardwalk light",
  "color": {"bg": "#F6F0DF", "ink": "#2A2118", "accent": "#7B4EBC", "accent2": "#B2402A", "muted": "#665647", "line": "#C0B3DB", "panel": "#EDE4CF", "chalk": "#2A2118"},
  "type": {"disp": {"family": "Fraunces", "weight": 300, "style": "italic"}, "mono": {"family": "Space Mono", "weight": 400}, "body": {"family": "DM Sans", "weight": 400}},
  "texture": "none",
  "tempo": {"ease": "expo", "beat_s": 4},
  "voice": {"register": "Academy boardwalk light: a lakeside boardwalk at dusk, soft violet and ember", "end_card": "CETI"} }
